[
  {
    "Id": "rule_5a40-93b3-6c2a-f7cb",
    "Name": "Unto the Anvil",
    "Type": "Rule",
    "Description": "This unit’s melee attacks can:\n\n\n- Re-roll wound rolls of 1.\n- Or: If the assault doctrine is active for this unit, re-roll wound rolls."
  },
  {
    "Id": "rule_68e4-3da0-f6ab-8624",
    "Name": "Lord of the Pyroclasts",
    "Type": "Rule",
    "Description": "While an enemy unit is engaged with this unit, that enemy unit has -1 OC."
  },
  {
    "Id": "rule_f678-23f8-a491-c7d2",
    "Name": "Leader",
    "Type": "Rule",
    "Description": "This model can be attached to the following units:\nASSAULT INTERCESSOR SQUAD, BLADEGUARD VETERAN SQUAD, COMPANY HEROES, INFERNUS SQUAD, INTERCESSOR SQUAD, STERNGUARD VETERAN SQUAD, VANGUARD VETERAN SQUAD"
  },
  {
    "Id": "rule_3b76-4053-ece9-6e7d",
    "Name": "Combat Doctrines",
    "Type": "Rule",
    "Description": "At the start of your Command phase, you can select one Combat Doctrine listed below. If you do, that Combat Doctrine is active for friendly ADEPTUS ASTARTES units with this ability until the start of your next Command Phase\n\n\nAssault Doctrine\nWhen this unit is selected to make an Advance move, that Advance move does not prevent this unit from being eligible to declare a charge. \n\n\nDevastator Doctrine\nThis unit's ranged attacks have [ASSAULT]\n\n\nTactical Doctrine\nWhen this unit is selected to make a Fall-back move, that Fall-back move does not prevent this unit from being eligible to shoot and eligible to declare a charge. \n\n\nUnless otherwise stated. \n- You can only select each Combat Doctrine once per battle\n- Only one Combat Doctrine can be active for each unit. If a rule make a Combat Doctrine active for a unit, any Combat Doctrine previously active for that unit is no longer active for that unit. \n\n"
  },
  {
    "Id": "rule_b4dd-3e1f-41cb-218f",
    "Name": "Leader",
    "Type": "Rule",
    "Description": "Before the battle, in the Muster Armies step, for each leader and support unit in your army, you can select one friendly bodyguard unit that unit can lead. That unit will then lead that bodyguard unit for the battle and form an attached unit with it. Unless otherwise stated, each bodyguard unit can only have one leader unit and one support unit attached to it."
  },
  {
    "Id": "rule_c6cc-c38c-dfe6-dbb8",
    "Name": "Transhuman Strategist",
    "Type": "Rule",
    "Description": "At the start of the battle round, if a model with this ability is your WARLORD, gain 1 CP"
  },
  {
    "Id": "rule_kw_close-quarters",
    "Name": "Close-quarters",
    "Type": "Rule",
    "Description": "Units containing one or more models with a **[CLOSE-QUARTERS]** weapon can shoot using **close-quarters shooting** (10.06). When using another **shooting type**, for each model in that unit (excluding **MONSTER/VEHICLE** models), you can only select one of the following to make attacks with: \n- One or more of its **[CLOSE-QUARTERS]** weapons. \n- One or more of its other ranged weapons."
  },
  {
    "Id": "rule_kw_torrent",
    "Name": "Torrent",
    "Type": "Rule",
    "Description": "Each time an attack is made with a **[TORRENT]** weapon, that attack automatically hits the target."
  },
  {
    "Id": "rule_kw_devastating-wounds",
    "Name": "Devastating Wounds",
    "Type": "Rule",
    "Description": "Each time an attack made with a **[DEVASTATING WOUNDS]** weapon results in a **critical wound**, the attack sequence for that attack ends and the target unit suffers a number of **mortal wounds** equal to the **D** characteristic of that weapon. These are inflicted after resolving any normal damage inflicted by those attacks. \n**Mortal wounds** inflicted by **[DEVASTATING WOUNDS]** weapons can damage a maximum of one model for each **critical wound**; any remaining **mortal wounds** inflicted by that attack are lost. \n***Example:** An attack made with a **[DEVASTATING WOUNDS]** weapon with a **D** characteristic of 3 results in a **critical wound** against an Intercessor Squad, so inflicts 3 **mortal wounds**. The first 2 **mortal wounds** are sufficient to **destroy** 1 Intercessor model, so the remaining **mortal wound** is lost.*"
  },
  {
    "Id": "rule_b423-2ef4-b87c-b65d",
    "Name": "Forgefather",
    "Type": "Rule",
    "Description": "In your Shooting phase, select one visible enemy unit within 24\" of this model. Friendly ^^**Adeptus Astartes**^^ units’ [Melta]/[Torrent] attacks that target that enemy unit have +2 S."
  },
  {
    "Id": "rule_22fa-126d-31e4-6a5a",
    "Name": "Seeker of the Unfound",
    "Type": "Rule",
    "Description": "The first time this model is set up on the battlefield, select one objective on the battlefield. While this model is within range of that objective, this model has:\n\n\n- 10 OC.\n- 5+ Ld.\n- Feel No Pain 4+."
  },
  {
    "Id": "rule_56bf-fb53-c81d-ff4a",
    "Name": "Leader",
    "Type": "Rule",
    "Description": "This model can be attached to the following units:\nASSAULT INTERCESSOR SQUAD, BLADEGUARD VETERAN SQUAD, COMPANY HEROES, ERADICATOR SQUAD WITH MELTA RIFLES, INFERNUS SQUAD, VANGUARD VETERAN SQUAD"
  },
  {
    "Id": "rule_kw_feel-no-pain",
    "Name": "Feel No Pain",
    "Type": "Rule",
    "Description": "This ability always takes the form **Feel No Pain X+**. Each time a model with this ability would lose a wound, roll one D6: on an **X+**, that wound is not lost. "
  }
]
