[
  {
    "Id": "rule_fd8a-2e51-e8c6-b34d",
    "Name": "Icon of Obstinacy",
    "Type": "Rule",
    "Description": "Attacks that target this unit have -1 to hit rolls."
  },
  {
    "Id": "rule_e9c8-e6ff-83d4-afee",
    "Name": "Leader",
    "Type": "Rule",
    "Description": "This model can be attached to the following units:\nTERMINATOR ASSAULT SQUAD, TERMINATOR SQUAD"
  },
  {
    "Id": "rule_f384-d8fa-760e-cc30",
    "Name": "Rampart",
    "Type": "Rule",
    "Description": "(Once per battle, per army)\nAt the start of any phase, you can use this ability. If you do, this model has 2+ InSv until the end of the phase."
  },
  {
    "Id": "rule_b4dd-3e1f-41cb-218f",
    "Name": "Leader",
    "Type": "Rule",
    "Description": "Before the battle, in the Muster Armies step, for each leader and support unit in your army, you can select one friendly bodyguard unit that unit can lead. That unit will then lead that bodyguard unit for the battle and form an attached unit with it. Unless otherwise stated, each bodyguard unit can only have one leader unit and one support unit attached to it."
  },
  {
    "Id": "rule_7cb5-dd6b-dd87-ad3b",
    "Name": "Deep Strike",
    "Type": "Rule",
    "Description": "Each time this unit makes an **ingress move** (20.04), if every model in this unit has this ability, it can be set up anywhere on the battlefield that is more than 8\" horizontally from all enemy units, even if that is within your opponent’s deployment zone."
  },
  {
    "Id": "rule_3b76-4053-ece9-6e7d",
    "Name": "Combat Doctrines",
    "Type": "Rule",
    "Description": "At the start of your Command phase, you can select one Combat Doctrine listed below. If you do, that Combat Doctrine is active for friendly ADEPTUS ASTARTES units with this ability until the start of your next Command Phase\n\n\nAssault Doctrine\nWhen this unit is selected to make an Advance move, that Advance move does not prevent this unit from being eligible to declare a charge. \n\n\nDevastator Doctrine\nThis unit's ranged attacks have [ASSAULT]\n\n\nTactical Doctrine\nWhen this unit is selected to make a Fall-back move, that Fall-back move does not prevent this unit from being eligible to shoot and eligible to declare a charge. \n\n\nUnless otherwise stated. \n- You can only select each Combat Doctrine once per battle\n- Only one Combat Doctrine can be active for each unit. If a rule make a Combat Doctrine active for a unit, any Combat Doctrine previously active for that unit is no longer active for that unit. \n\n"
  },
  {
    "Id": "rule_c6cc-c38c-dfe6-dbb8",
    "Name": "Transhuman Strategist",
    "Type": "Rule",
    "Description": "At the start of the battle round, if a model with this ability is your WARLORD, gain 1 CP"
  },
  {
    "Id": "rule_kw_cleave",
    "Name": "Cleave",
    "Type": "Rule",
    "Description": "This ability always takes the form **[CLEAVE X]**. Each time you gather **attack dice** for a **[CLEAVE]** weapon, if you only selected one target for all of that weapon’s attacks, add **X** additional **attack dice** for every five models that were in the target unit in the Select Targets step (rounding down). \n***Example: If a **[CLEAVE 1]** weapon with an **A** characteristic of 3 targets one unit containing 16 models, you would gather three additional **attack dice** for that weapon (for a total of six for that weapon).*"
  },
  {
    "Id": "rule_kw_devastating-wounds",
    "Name": "Devastating Wounds",
    "Type": "Rule",
    "Description": "Each time an attack made with a **[DEVASTATING WOUNDS]** weapon results in a **critical wound**, the attack sequence for that attack ends and the target unit suffers a number of **mortal wounds** equal to the **D** characteristic of that weapon. These are inflicted after resolving any normal damage inflicted by those attacks. \n**Mortal wounds** inflicted by **[DEVASTATING WOUNDS]** weapons can damage a maximum of one model for each **critical wound**; any remaining **mortal wounds** inflicted by that attack are lost. \n***Example:** An attack made with a **[DEVASTATING WOUNDS]** weapon with a **D** characteristic of 3 results in a **critical wound** against an Intercessor Squad, so inflicts 3 **mortal wounds**. The first 2 **mortal wounds** are sufficient to **destroy** 1 Intercessor model, so the remaining **mortal wound** is lost.*"
  },
  {
    "Id": "rule_dee6-67e8-9a8b-f5cd",
    "Name": "Signum Array",
    "Type": "Rule",
    "Description": "In your Shooting phase, you can select one visible enemy unit within 18\" of this unit. That enemy unit cannot have the benefit of cover."
  },
  {
    "Id": "rule_653d-148d-7c06-2436",
    "Name": "Siege Captain",
    "Type": "Rule",
    "Description": "This model’s attacks that target a ^^**Fortification/Monster/Vehicle**^^ unit have +2 S, AP and D."
  },
  {
    "Id": "rule_60a-b484-e0d7-43b7",
    "Name": "Leader",
    "Type": "Rule",
    "Description": "This model can be attached to the following units:\nAGGRESSOR SQUAD, ERADICATOR SQUAD WITH HEAVY BOLTERS, ERADICATOR SQUAD WITH MELTA RIFLES, HEAVY INTERCESSOR SQUAD"
  },
  {
    "Id": "rule_kw_anti",
    "Name": "Anti",
    "Type": "Rule",
    "Description": "This ability always takes the form **[ANTI-X Y+]**. Each time an attack is made with an **[ANTI]** weapon, if the target unit has the keyword denoted by **X**, an unmodified **wound roll** of **Y+** is a **critical wound**.\n***Example:** An attack made with an **[ANTI-VEHICLE 4+]** weapon against a ^^**Vehicle**^^ unit will result in a **critical wound** on an unmodified **wound roll** of 4+, while an attack made with an **[ANTI-PSYKER 2+]** weapon against a ^^**Psyker**^^ unit will result in a **critical wound** on an unmodified **wound roll** of 2+.*"
  },
  {
    "Id": "rule_5324-763c-61f5-9e4b",
    "Name": "Oath of Rynn",
    "Type": "Rule",
    "Description": "Once per battle, at the start of either player’s Command phase, this model can use this ability. When it does, until the end of the turn, add 1 to the Attacks characteristic of weapons equipped by models in this model’s unit."
  },
  {
    "Id": "rule_b20-ca96-c186-27dc",
    "Name": "To the Last",
    "Type": "Rule",
    "Description": "While this model is leading a unit, each time a model in that unit makes an attack, add 1 to the Hit roll if that unit is below its Starting Strength, and add 1 to the Wound roll as well if that unit is Below Half-strength."
  },
  {
    "Id": "rule_39c9-ff24-66c5-c3aa",
    "Name": "Leader",
    "Type": "Rule",
    "Description": "This model can be attached to the following units:\n\n■ BLADEGUARD VETERAN SQUAD\n■ COMPANY HEROES\n■ STERNGUARD VETERAN SQUAD\n■ TACTICAL SQUAD"
  },
  {
    "Id": "rule_1544-468d-6b7c-a26b",
    "Name": "Inspiring Commander",
    "Type": "Rule",
    "Description": "If you include this model in your army, until the end of the battle, non-Character models in Sternguard\nVeteran Squad units from your army have an Objective Control characteristic of 2 while they are not Battle-shocked."
  },
  {
    "Id": "rule_9bf4-280f-bbe2-6fbb",
    "Name": "Feel No Pain",
    "Type": "Rule",
    "Description": "This ability always takes the form **Feel No Pain X+**. Each time a model with this ability would lose a wound, roll one D6: on an **X+**, that wound is not lost. "
  },
  {
    "Id": "rule_kw_rapid-fire",
    "Name": "Rapid Fire",
    "Type": "Rule",
    "Description": "This ability always takes the form **[RAPID FIRE X]**. Each time you gather **attack dice** for a **[RAPID FIRE]** weapon, add **X** additional **attack dice** if the target unit was within half range of that weapon in the Select Targets step. \n***Example:** If a **[RAPID FIRE 1]** weapon with an **A** characteristic of 1 targets a unit that is within half range, you would gather one additional **attack dice** for that weapon (for a total of two for that weapon).*"
  },
  {
    "Id": "rule_kw_sustained-hits",
    "Name": "Sustained Hits",
    "Type": "Rule",
    "Description": "This ability always takes the form **[SUSTAINED HITS X]**. Each time an attack made with a **[SUSTAINED HITS]** weapon results in a **critical hit**, that attack results in a number of additional hits on the target as denoted by **X**.\n***Example:** An attack made with a **[SUSTAINED HITS 2]** weapon results in a **critical hit**. That attack therefore hits the target three times (once from the **critical hit**, and twice more from the **[SUSTAINED HITS 2]** ability).*"
  }
]
