[
  {
    "Id": "rule_143-1a21-8afb-16c4",
    "Name": "For the Khan!",
    "Type": "Rule",
    "Description": "- This unit’s ranged attacks have [ASSAULT]\n- This unit’s melee attacks have [LANCE]."
  },
  {
    "Id": "rule_bbb5-617e-a254-8463",
    "Name": "Trophy Taker",
    "Type": "Rule",
    "Description": "This unit’s attacks that target a Character unit can:\n\n- Re-roll hit rolls of 1\n- Re-roll wound rolls of 1."
  },
  {
    "Id": "rule_90b4-a746-de9b-2df2",
    "Name": "Leader",
    "Type": "Rule",
    "Description": "This model can be attached to the following units: ASSAULT INTERCESSOR SQUAD, BLADEGUARD VETERAN SQUAD, COMPANY HEROES, INTERCESSOR SQUAD, STERNGUARD VETERAN SQUAD, VANGUARD VETERAN SQUAD"
  },
  {
    "Id": "rule_3b76-4053-ece9-6e7d",
    "Name": "Combat Doctrines",
    "Type": "Rule",
    "Description": "At the start of your Command phase, you can select one Combat Doctrine listed below. If you do, that Combat Doctrine is active for friendly ADEPTUS ASTARTES units with this ability until the start of your next Command Phase\n\n\nAssault Doctrine\nWhen this unit is selected to make an Advance move, that Advance move does not prevent this unit from being eligible to declare a charge. \n\n\nDevastator Doctrine\nThis unit's ranged attacks have [ASSAULT]\n\n\nTactical Doctrine\nWhen this unit is selected to make a Fall-back move, that Fall-back move does not prevent this unit from being eligible to shoot and eligible to declare a charge. \n\n\nUnless otherwise stated. \n- You can only select each Combat Doctrine once per battle\n- Only one Combat Doctrine can be active for each unit. If a rule make a Combat Doctrine active for a unit, any Combat Doctrine previously active for that unit is no longer active for that unit. \n\n"
  },
  {
    "Id": "rule_b4dd-3e1f-41cb-218f",
    "Name": "Leader",
    "Type": "Rule",
    "Description": "Before the battle, in the Muster Armies step, for each leader and support unit in your army, you can select one friendly bodyguard unit that unit can lead. That unit will then lead that bodyguard unit for the battle and form an attached unit with it. Unless otherwise stated, each bodyguard unit can only have one leader unit and one support unit attached to it."
  },
  {
    "Id": "rule_c6cc-c38c-dfe6-dbb8",
    "Name": "Transhuman Strategist",
    "Type": "Rule",
    "Description": "At the start of the battle round, if a model with this ability is your WARLORD, gain 1 CP"
  },
  {
    "Id": "rule_kw_close-quarters",
    "Name": "Close-quarters",
    "Type": "Rule",
    "Description": "Units containing one or more models with a **[CLOSE-QUARTERS]** weapon can shoot using **close-quarters shooting** (10.06). When using another **shooting type**, for each model in that unit (excluding **MONSTER/VEHICLE** models), you can only select one of the following to make attacks with: \n- One or more of its **[CLOSE-QUARTERS]** weapons. \n- One or more of its other ranged weapons."
  },
  {
    "Id": "rule_kw_anti",
    "Name": "Anti",
    "Type": "Rule",
    "Description": "This ability always takes the form **[ANTI-X Y+]**. Each time an attack is made with an **[ANTI]** weapon, if the target unit has the keyword denoted by **X**, an unmodified **wound roll** of **Y+** is a **critical wound**.\n***Example:** An attack made with an **[ANTI-VEHICLE 4+]** weapon against a ^^**Vehicle**^^ unit will result in a **critical wound** on an unmodified **wound roll** of 4+, while an attack made with an **[ANTI-PSYKER 2+]** weapon against a ^^**Psyker**^^ unit will result in a **critical wound** on an unmodified **wound roll** of 2+.*"
  },
  {
    "Id": "rule_kw_devastating-wounds",
    "Name": "Devastating Wounds",
    "Type": "Rule",
    "Description": "Each time an attack made with a **[DEVASTATING WOUNDS]** weapon results in a **critical wound**, the attack sequence for that attack ends and the target unit suffers a number of **mortal wounds** equal to the **D** characteristic of that weapon. These are inflicted after resolving any normal damage inflicted by those attacks. \n**Mortal wounds** inflicted by **[DEVASTATING WOUNDS]** weapons can damage a maximum of one model for each **critical wound**; any remaining **mortal wounds** inflicted by that attack are lost. \n***Example:** An attack made with a **[DEVASTATING WOUNDS]** weapon with a **D** characteristic of 3 results in a **critical wound** against an Intercessor Squad, so inflicts 3 **mortal wounds**. The first 2 **mortal wounds** are sufficient to **destroy** 1 Intercessor model, so the remaining **mortal wound** is lost.*"
  },
  {
    "Id": "rule_kw_precision",
    "Name": "Precision",
    "Type": "Rule",
    "Description": "While resolving attacks made with one or more **[PRECISION]** weapons, at the start of the Allocation Order step (05.03), if the target unit contains one or more **CHARACTER** models **visible** to one or more of the attacking models, the active player can select one allocation group that contains one of those **visible CHARACTER** models. If they do, until those attacks are resolved, or until that **CHARACTER** group is **destroyed** (whichever happens first), that **CHARACTER** group is the current allocation group."
  },
  {
    "Id": "rule_1336-8c9c-a513-990d",
    "Name": "Spear of Chogoris",
    "Type": "Rule",
    "Description": "- This unit’s ranged attacks have [Assault].\n- When this unit is selected to make an advance move, that advance move does not prevent this unit from being eligible to declare a charge.\n- If the assault doctrine is active for this unit, this unit has +1 to advance rolls and charge rolls."
  },
  {
    "Id": "rule_886d-0aad-f792-2794",
    "Name": "Skilled Riders",
    "Type": "Rule",
    "Description": "This unit has Mobile."
  },
  {
    "Id": "rule_fe8b-e1ef-ef3c-cced",
    "Name": "Leader",
    "Type": "Rule",
    "Description": "This model can be attached to the following units: OUTRIDER SQUAD"
  },
  {
    "Id": "rule_kw_lance",
    "Name": "Lance",
    "Type": "Rule",
    "Description": "Each time an attack is made with a **[LANCE]** weapon, if the attacking model’s unit made a **charge move** this turn, add 1 to the **wound roll**."
  },
  {
    "Id": "rule_kw_extra-attacks",
    "Name": "Extra Attacks",
    "Type": "Rule",
    "Description": "Each time a unit containing one or more models with an **[EXTRA ATTACKS]** weapon fights, those models will make attacks with those weapons in addition to any others. In the Select Weapons step (04.01), for each of those models, you must select: \n- All of that model’s **[EXTRA ATTACKS]** weapons. \n- One of that model’s other melee weapons, if possible."
  },
  {
    "Id": "rule_kw_sustained-hits",
    "Name": "Sustained Hits",
    "Type": "Rule",
    "Description": "This ability always takes the form **[SUSTAINED HITS X]**. Each time an attack made with a **[SUSTAINED HITS]** weapon results in a **critical hit**, that attack results in a number of additional hits on the target as denoted by **X**.\n***Example:** An attack made with a **[SUSTAINED HITS 2]** weapon results in a **critical hit**. That attack therefore hits the target three times (once from the **critical hit**, and twice more from the **[SUSTAINED HITS 2]** ability).*"
  }
]
